RET,RET-10,RET-10-1C,RET-10-1C-10,RET-10-1C-10-14,Double Horse,"Double Horse Pickle - Prawn, 400 g Bottle",Double Horse Pickle - Prawn 400 g,400 g Bottle,g,400 g Bottle,1,1,249,249,"Manjilas Food Tech Pvt Ltd,",India,['40009964'],-,https://datalabs.siva3.io/image/Eunimart_groceries_40009964_4-double-horse-pickle-prawn.jpg,https://datalabs.siva3.io/image/Eunimart_groceries_40009964-2_5-double-horse-pickle-prawn.jpg,https://datalabs.siva3.io/image/Eunimart_groceries_40009964-3_5-double-horse-pickle-prawn.jpg,https://datalabs.siva3.io/image/Eunimart_groceries_40009964-4_5-double-horse-pickle-prawn.jpg,https://datalabs.siva3.io/image/Eunimart_groceries_40009964-5_5-double-horse-pickle-prawn.jpg,-,-,-,-,-,-,-,-,-,-,-,-,-,-,-,-,-,-,-,-,-,-,-,-,-,-,-,"[{'EAN Code': '40009964'}, {'Country Of Origin': 'India'}]",-,-,-,-,"Prawn Pieces, Salt, Ginger, Garlic, Chilli Powder, Green Chilli, Fenugreek, Mustard, Gingelly Oil, Synthetic Vinegar, Turmeric Powder,",-,-
RET,RET-10,RET-10-1C,RET-10-1C-10,RET-10-1C-10-14,Double Horse,"Double Horse Pickle - Tender Mango, 150 g Bottle","Add zest and zing to your boring meal with a spicy taste of Double Horse Tender Mango Pickle. With this, you can enjoy a blend of fresh mangoes packed in one bottle. Thus it has something to delight every palate. Its extremely tempting flavour is the outcome of fresh mangoes with aromatic spices. So, add life to your mealtime with this pickle. It can be enjoyed with your normal Curd Rice, Dosa, Poori, Bread, Chappati, etc.",150 g Bottle,g,150 g Bottle,1,1,99,99,"Manjilas Food Tech Pvt Ltd,",India,['30004910'],-,https://datalabs.siva3.io/image/Eunimart_groceries_30004910_3-double-horse-pickle-tender-mango.jpg,https://datalabs.siva3.io/image/Eunimart_groceries_30004910-2_1-double-horse-pickle-tender-mango.jpg,https://datalabs.siva3.io/image/Eunimart_groceries_30004910-3_1-double-horse-pickle-tender-mango.jpg,https://datalabs.siva3.io/image/Eunimart_groceries_30004910-4_1-double-horse-pickle-tender-mango.jpg,https://datalabs.siva3.io/image/Eunimart_groceries_30004910-5_1-double-horse-pickle-tender-mango.jpg,-,-,-,-,-,-,-,-,-,-,-,-,-,-,-,-,-,-,-,-,-,-,-,-,-,-,-,"[{'EAN Code': '30004910'}, {'Country Of Origin': 'India'}]",-,-,-,-,"Tender Mango, Chilly Powder, Salt, Mustard, Fenugreek, Synthetic Vinegar, Asafoetida. Class Ii Preservatives",-,-
RET,RET-10,RET-10-1C,RET-10-1C-10,RET-10-1C-10-14,Eastern,"Eastern Chicken Pickle, 150 g","Eastern Chicken pickle is a spicy traditional condiment of Kerala. Chicken cubes are marinated in ginger, garlic and an array of spices. The rich, piquant pickle is commonly served with dosas, rotis and rice.",150 g,g,150 g,1,1,120,120,"Eastern Condiments Pvt Ltd, PB No15, Eastern Valley, Adimali Kerala, India 685561",India,['8901440209980'],['10012041000058'],https://datalabs.siva3.io/image/Eunimart_groceries_40173098_3-eastern-chicken-pickle.jpg,https://datalabs.siva3.io/image/Eunimart_groceries_40173098-2_3-eastern-chicken-pickle.jpg,https://datalabs.siva3.io/image/Eunimart_groceries_40173098-3_3-eastern-chicken-pickle.jpg,https://datalabs.siva3.io/image/Eunimart_groceries_40173098-4_3-eastern-chicken-pickle.jpg,https://datalabs.siva3.io/image/Eunimart_groceries_40173098-5_2-eastern-chicken-pickle.jpg,-,-,-,-,-,-,-,-,-,-,-,-,-,-,-,-,-,-,-,-,-,-,-,-,-,-,-,"[{'EAN Code': '8901440209980'}, {'FSSAI Number': '10012041000058'}, {'Manufactured & Marketed by': 'Eastern Condiments Pvt Ltd, PB No15, Eastern Valley, Adimali Kerala, India 685561'}]","Eastern Condiments Pvt Ltd, PB No15, Eastern Valley, Adimali Kerala, India 685561",-,-,-,"Fried Chicken Pieces, Tomato, Garlic, Ginger, Green Chilli, Redchilli Powders, Salt, Refined Oil, Turmeric Powders, Garam Masala, Mustard, Fenugreek, Synthetic Vinegar, Contains Permitted Class Ii Preservative (Sodium Benzoate)",-,-
RET,RET-10,RET-10-1C,RET-10-1C-10,RET-10-1C-10-14,Eastern,"Eastern Fish Pickle, 150 g","Eastern Fish pickle is a delicious and appetizing version of the popular Kerala fish pickle. The product is prepared from fried fish pieces marinated in oil and aromatic spices. It serves as an excellent side dish to rice, roti and naan.",150 g,g,150 g,1,1,90,90,"Eastern Condiments Pvt Ltd, PB No15, Eastern Valley, Adimali Kerala, India 685561",India,['8901440209959'],['10012041000058'],https://datalabs.siva3.io/image/Eunimart_groceries_40173100_3-eastern-fish-pickle.jpg,https://datalabs.siva3.io/image/Eunimart_groceries_40173100-2_4-eastern-fish-pickle.jpg,https://datalabs.siva3.io/image/Eunimart_groceries_40173100-3_4-eastern-fish-pickle.jpg,https://datalabs.siva3.io/image/Eunimart_groceries_40173100-4_4-eastern-fish-pickle.jpg,https://datalabs.siva3.io/image/Eunimart_groceries_40173100-5_3-eastern-fish-pickle.jpg,-,-,-,-,-,-,-,-,-,-,-,-,-,-,-,-,-,-,-,-,-,-,-,-,-,-,-,"[{'EAN Code': '8901440209959'}, {'FSSAI Number': '10012041000058'}, {'Manufactured & Marketed by': 'Eastern Condiments Pvt Ltd, PB No15, Eastern Valley, Adimali Kerala, India 685561'}]","Eastern Condiments Pvt Ltd, PB No15, Eastern Valley, Adimali Kerala, India 685561",-,-,-,"Fried Fish Pieces, Ginger, Garlic, &Nbsp;Green Chilli, Fenugreek, Mustard, Mustard Split, Sesame Oil, Salt, Turmeric Powders, Synthetic Vinegar, Tomato Pulp Spices, Contains Permitted Class Ii Preservative (Sodium Benzoate)",-,-
RET,RET-10,RET-10-1C,RET-10-1C-10,RET-10-1C-10-14,Eastern,"Eastern Prawn Pickle, 150 g",Eastern Prawn pickle is a spicy savoury pickle made with fresh prawns. The delightful combination of spices gives an authentic touch to the pickle. The taste of traditional Kerala prawn pickle is felt in every bite.,150 g,g,150 g,1,1,95,95,"Eastern Condiments Pvt Ltd, PB No15, Eastern Valley, Adimali Kerala, India 685561",India,['40173099'],['10012041000058'],https://datalabs.siva3.io/image/Eunimart_groceries_40173099_3-eastern-prawn-pickle.jpg,https://datalabs.siva3.io/image/Eunimart_groceries_40173099-2_4-eastern-prawn-pickle.jpg,https://datalabs.siva3.io/image/Eunimart_groceries_40173099-3_4-eastern-prawn-pickle.jpg,https://datalabs.siva3.io/image/Eunimart_groceries_40173099-4_4-eastern-prawn-pickle.jpg,https://datalabs.siva3.io/image/Eunimart_groceries_40173099-5_3-eastern-prawn-pickle.jpg,-,-,-,-,-,-,-,-,-,-,-,-,-,-,-,-,-,-,-,-,-,-,-,-,-,-,-,"[{'EAN Code': '40173099'}, {'FSSAI Number': '10012041000058'}, {'Manufactured & Marketed by': 'Eastern Condiments Pvt Ltd, PB No15, Eastern Valley, Adimali Kerala, India 685561'}]","Eastern Condiments Pvt Ltd, PB No15, Eastern Valley, Adimali Kerala, India 685561",-,-,-,"Fried Prawns Pieces, Ginger, Garlic, Green Chilli, Fenugreek, Mustard, Mustard Split, Sesame Oil, Salt, Turmeric Powders, Synthetic Vinegar, Tomato Pulp Spices, Contains Permitted Class Ii Preservative (Sodium Benzoate)",-,-
RET,RET-10,RET-10-1C,RET-10-1C-10,RET-10-1C-10-14,Farmveda,"Farmveda Chutney Podi - Groundnut, 100 g","FarmVedas traditional Groundnut chutney podi is 100% natural, nutritious and full of flavour to match the taste of your grandmother's preparation. We use top quality groundnut rich in proteins and minerals making it perfect with an idli/dosa breakfast. Recommended for weight-watchers. The farmers who own FarmVeda ensure that the best quality food reaches your table.",100 g,g,100 g,1,1,60,60,"Sankethi Food Products, #155, Madappa building, 1st main road, Mallathalli, Bangalore-560057",India,['40103762'],-,https://datalabs.siva3.io/image/Eunimart_groceries_40103762_2-farmveda-chutney-podi-groundnut.jpg,https://datalabs.siva3.io/image/Eunimart_groceries_40103762-2_2-farmveda-chutney-podi-groundnut.jpg,https://datalabs.siva3.io/image/Eunimart_groceries_40103762-3_1-farmveda-chutney-podi-groundnut.jpg,https://datalabs.siva3.io/image/Eunimart_groceries_40103762-4_1-farmveda-chutney-podi-groundnut.jpg,https://datalabs.siva3.io/image/Eunimart_groceries_40103762-5_1-farmveda-chutney-podi-groundnut.jpg,-,-,-,-,-,-,-,-,-,-,-,-,-,-,-,-,-,-,-,-,-,-,-,-,-,-,"Mix with ghee and just plain podi to be eaten along with idlis, dosas, uttappams, upmas etc. Enhances the taste of just about any dal or subzi. Tastes great as a youghurt dip for khakras and mathris.","[{'EAN Code': '40103762'}, {'Country Of Origin': 'India'}, {'Manufacturer Name & ': 'Sankethi Food Products, #155, Madappa building, 1st main road, Mallathalli, Bangalore-560057'}]",-,-,-,-,"Groundnuts, Copra, Red Chillis, Tamarind, Asafoetida, Curry Leaves, Salt, Malic Acid, Sugar And Vegetable Oil",-,-
RET,RET-10,RET-10-1C,RET-10-1C-10,RET-10-1C-10-14,Farmveda,"Farmveda Chutney Podi, 100 g","FarmVedas traditional South Indian idli/dosa chutney is 100% natural, nutritious, aromatic and full of flavour to match the taste of your grandmother's preparation. The farmers who own FarmVeda ensure that the best quality food reaches your table.",100 g,g,100 g,1,1,60,60,"Sankethi Food Products, #155, Madappa building, 1st main road, Mallathalli, Bangalore-560058",India,['40103763'],-,https://datalabs.siva3.io/image/Eunimart_groceries_40103763_2-farmveda-chutney-podi.jpg,https://datalabs.siva3.io/image/Eunimart_groceries_40103763-2_2-farmveda-chutney-podi.jpg,https://datalabs.siva3.io/image/Eunimart_groceries_40103763-3_1-farmveda-chutney-podi.jpg,https://datalabs.siva3.io/image/Eunimart_groceries_40103763-4_1-farmveda-chutney-podi.jpg,https://datalabs.siva3.io/image/Eunimart_groceries_40103763-5_1-farmveda-chutney-podi.jpg,-,-,-,-,-,-,-,-,-,-,-,-,-,-,-,-,-,-,-,-,-,-,-,-,-,-,"Mix with ghee and just plain podi to be eaten along with idlis, dosas, uttappams, upmas etc. Enhances the taste of just about any dal or subzi. Tastes great as a youghurt dip for khakras and mathris.","[{'EAN Code': '40103763'}, {'Country Of Origin': 'India'}, {'Manufacturer Name & ': 'Sankethi Food Products, #155, Madappa building, 1st main road, Mallathalli, Bangalore-560058'}]",-,-,-,-,"Urad Dal, Chana Dal, Copra, Aesafotida, Curry Leaves, Red Chilli, Tamarind Concentrate, Salt, Sugar, Malic Acid And Vegetable Oil",-,-
RET,RET-10,RET-10-1C,RET-10-1C-10,RET-10-1C-10-14,Farmveda,"Farmveda Ready To Eat - Andhra Gun Powder, 100 g","FarmVedas Andhra Gunpowder used the traditional Andhra recipe and is 100% natural, nutritious and full of flavour to match the taste of your grandmothers preparation. Mix generously into cooked rice with ghee or sprinkle on hot parathas for an unforgettable experience. Our customers tell us that FarmVeda Andhra Gun Powder enhances the taste of just about any dal or subzi, tastes great as a youghurt dip and even as a salad dressing. The farmers who own FarmVeda ensure that the best quality food reaches your table.",100 g,g,100 g,1,1,60,60,"Sankethi Food Products, #155, Madappa building, 1st main road, Mallathalli, Bangalore-560056",India,['40103761'],-,https://datalabs.siva3.io/image/Eunimart_groceries_40103761_2-farmveda-ready-to-eat-andhra-gun-powder.jpg,https://datalabs.siva3.io/image/Eunimart_groceries_40103761-2_2-farmveda-ready-to-eat-andhra-gun-powder.jpg,https://datalabs.siva3.io/image/Eunimart_groceries_40103761-3_1-farmveda-ready-to-eat-andhra-gun-powder.jpg,https://datalabs.siva3.io/image/Eunimart_groceries_40103761-4_1-farmveda-ready-to-eat-andhra-gun-powder.jpg,https://datalabs.siva3.io/image/Eunimart_groceries_40103761-5_1-farmveda-ready-to-eat-andhra-gun-powder.jpg,https://datalabs.siva3.io/image/Eunimart_groceries_40103761-6_1-farmveda-ready-to-eat-andhra-gun-powder.jpg,-,-,-,-,-,-,-,-,-,-,-,-,-,-,-,-,-,-,-,-,-,-,-,-,-,Mix generously into cooked rice with ghee or sprinkle on hot parathas for an unforgettable experience. Tastes great with sesame oil (til ka tel). Enhances the taste of just about any dal or sabzi. Tastes great as a yoghurt dip for khakras and mathris. Sprinkle as a salad dressing.,"[{'EAN Code': '40103761'}, {'Country Of Origin': 'India'}, {'Manufacturer Name & ': 'Sankethi Food Products, #155, Madappa building, 1st main road, Mallathalli, Bangalore-560056'}]",-,-,-,-,"Toor Dal, Salt, Sugar, Asafoetida, Red Chillies, Curry Leaves, Malic Acid & Vegetable Oil",-,-
RET,RET-10,RET-10-1C,RET-10-1C-10,RET-10-1C-10-14,Future Organics,"Future Organics Pickle - Garlic With Olive Oil, 160 g",Garlic from traditional times is an essential herb known for its health benefits. A combination of cold pressed olive oil of the highest quality & this precious Herb is both great to taste & good for health.,160 g,g,160 g,1,1,200,200,"DEGA FARMS : CHOKANATHAPURAM VILLAGE, KAGGANUR- NALLUR ROAD, HOSUR TALUK, TAMIL NADU, INDIA",India,['8906676067465'],-,https://datalabs.siva3.io/image/Eunimart_groceries_65053_2-future-organics-pickle-garlic-with-olive-oil.jpg,-,-,-,-,-,-,-,-,-,-,-,-,-,-,-,-,-,-,-,-,-,-,-,-,-,-,-,-,-,-,Mix with hot rice add ghee and Serve,"[{'EAN Code': '8906676067465'}, {'Manufacturer Name & ': 'DEGA FARMS : CHOKANATHAPURAM VILLAGE, KAGGANUR- NALLUR ROAD, HOSUR TALUK, TAMIL NADU, INDIA'}]",-,-,-,-,"Garlic Pearls, Red Chilli Powder, Salt, Mustard Powder, Methi Powder, Turmeric Powder, Lemon Juice Cold Pressed Olive Oil",-,Garlic from traditional times is an essential herb known for its health benefits. A combination of cold pressed olive oil of the highest quality & this precious Herb is both great to taste & good for health.
RET,RET-10,RET-10-1C,RET-10-1C-10,RET-10-1C-10-14,Future Organics,"Future Organics Pickle - Ginger Herbal With Olive Oil, 160 g",Ginger is a known herb from the kitchen to upkeep the best of health. Its known to everyone for its immense medicinal value. A combination of this with cold-pressed olive oil along with other ingredients used of The highest quality produces a healthy & tasty pickle for the health Conscious connoisseur.,160 g,g,160 g,1,1,225,225,"DEGA FARMS : CHOKANATHAPURAM VILLAGE, KAGGANUR- NALLUR ROAD, HOSUR TALUK, TAMIL NADU, INDIA",India,['89898765419'],-,https://datalabs.siva3.io/image/Eunimart_groceries_65054_2-future-organics-pickle-ginger-herbal-with-olive-oil.jpg,-,-,-,-,-,-,-,-,-,-,-,-,-,-,-,-,-,-,-,-,-,-,-,-,-,-,-,-,-,-,Mix with hot rice add ghee and serve.,"[{'EAN Code': '89898765419'}, {'Country of origin': 'India'}, {'Manufacturer Name & ': 'DEGA FARMS : CHOKANATHAPURAM VILLAGE, KAGGANUR- NALLUR ROAD, HOSUR TALUK, TAMIL NADU, INDIA'}]",-,-,-,-,"Ginger, Mango Ginger, Turmeric Powder, Jaggery, Tamarind, Garlic Menthol Powder, Red Chilli Powder, Salt & Cold Pressed Olive Oil.",-,-
RET,RET-10,RET-10-1C,RET-10-1C-10,RET-10-1C-10-14,Future Organics,"Future Organics Pickle - Pudina With Olive Oil, 160 g",Pudina or Mint is known to be a healthy herb from traditional times and Is commonly used in every traditional home. Here its combined with Healthy cold pressed olive oil of the best quality to make it more healthy Which you can use every day with all your tiffin & meals because its Taste really great.,160 g,g,160 g,1,1,225,225,"DEGA FARMS : CHOKANATHAPURAM VILLAGE, KAGGANUR- NALLUR ROAD, HOSUR TALUK, TAMIL NADU, INDIA",India,['8906676016296'],-,https://datalabs.siva3.io/image/Eunimart_groceries_65052_2-future-organics-pickle-pudina-with-olive-oil.jpg,-,-,-,-,-,-,-,-,-,-,-,-,-,-,-,-,-,-,-,-,-,-,-,-,-,-,-,-,-,-,Mix with hot rice add ghee and serve.,"[{'EAN Code': '8906676016296'}, {'Country of origin': 'India'}, {'Manufacturer Name & ': 'DEGA FARMS : CHOKANATHAPURAM VILLAGE, KAGGANUR- NALLUR ROAD, HOSUR TALUK, TAMIL NADU, INDIA'}]",-,-,-,-,"Pudina Leaves, Red Chilli Powder Salt, Menthi Powder. Turmeric Powder, Garlic & Cold Pressed Olive Oil.",-,-
RET,RET-10,RET-10-1C,RET-10-1C-10,RET-10-1C-10-14,Future Organics,"Future Organics Pickle - Special Ginger, 160 g Bottle",Ginger pickles are used to reduce digestive ailments like gas and nausea. It also improves immunity and is helpful in keeping the body in good health without any diseases and tensions. The pickles are made from naturally and organically procured vegetables and fruits and do not contain any preservatives.,160 g Bottle,g,160 g Bottle,1,1,150,150,"DEGA FARMS : CHOKANATHAPURAM VILLAGE, KAGGANUR- NALLUR ROAD, HOSUR TALUK, TAMIL NADU, INDIA",India,['89898765406'],-,https://datalabs.siva3.io/image/Eunimart_groceries_40024235_2-future-organics-pickle-special-ginger.jpg,-,-,-,-,-,-,-,-,-,-,-,-,-,-,-,-,-,-,-,-,-,-,-,-,-,-,-,-,-,-,"Ginger pickles are commonly made during winters. It can be a perfect accompaniment to rice, idli, dosa, pesarattu and ghee.","[{'EAN Code': '89898765406'}, {'Country Of Origin': 'India'}, {'Manufacturer Name & ': 'DEGA FARMS : CHOKANATHAPURAM VILLAGE, KAGGANUR- NALLUR ROAD, HOSUR TALUK, TAMIL NADU, INDIA'}]",-,-,-,-,"Red Chillies Ginger, Tamarind, Sesame Oil, Salt, Red Chilli Powder, Fenugreek Seed Powder, Garlic.",-,-
RET,RET-10,RET-10-1C,RET-10-1C-10,RET-10-1C-10-14,Future Organics,"Future Organics Powder - Curry Leaf, 100 g Pouch",We would like to present this as specially made organic curry leaves podi made typically in style. This powder has exquisitely made with special ingredients that are used by NRIs living abroad. All the ingredients are used are fully organic.,100 g Pouch,g,100 g Pouch,1,1,140,140,"DEGA FARMS : CHOKANATHAPURAM VILLAGE, KAGGANUR- NALLUR ROAD, HOSUR TALUK, TAMIL NADU, INDIA",India,['8906676067977'],-,https://datalabs.siva3.io/image/Eunimart_groceries_40026106_4-future-organics-powder-curry-leaf.jpg,https://datalabs.siva3.io/image/Eunimart_groceries_40026106-2_5-future-organics-powder-curry-leaf.jpg,https://datalabs.siva3.io/image/Eunimart_groceries_40026106-3_5-future-organics-powder-curry-leaf.jpg,https://datalabs.siva3.io/image/Eunimart_groceries_40026106-4_5-future-organics-powder-curry-leaf.jpg,https://datalabs.siva3.io/image/Eunimart_groceries_40026106-5_4-future-organics-powder-curry-leaf.jpg,-,-,-,-,-,-,-,-,-,-,-,-,-,-,-,-,-,-,-,-,-,-,-,-,-,-,Mix with hot rice add ghee and serve.,"[{'EAN Code': '8906676067977'}, {'Country Of Origin': 'India'}, {'Manufacturer Name & ': 'DEGA FARMS : CHOKANATHAPURAM VILLAGE, KAGGANUR- NALLUR ROAD, HOSUR TALUK, TAMIL NADU, INDIA'}]",-,-,-,-,"Curry Leaves, Black Gram, Coriander Seeds, Salt And Garlic",-,-
RET,RET-10,RET-10-1C,RET-10-1C-10,RET-10-1C-10-14,GEETARTH,"GEETARTH Curry Leaves Chutney, 100 g","Curry Leave is a healthy ready to eat Chutney that can be used as a side dish along with many morning snacks/breakfast/meals. Also, it can be used while cooking vegetables. It is tasty and healthy if mixed with curd.
Chutney is a traditional accompaniment and integral part of Indian cuisine, it is made from various kinds of spices, fruits, and seeds varies with the kind of chutney. Chutney will be sweet, tangy and spicy as per variety.",100 g,g,100 g,1,1,65,65,"Sujata Home Products, B4/303, Whistling Palms, Wakad, Pune, 411057",India,['40191739'],['11516037000266'],https://datalabs.siva3.io/image/Eunimart_groceries_40191739_1-geetarth-curry-leaves-chutney.jpg,https://datalabs.siva3.io/image/Eunimart_groceries_40191739-2_1-geetarth-curry-leaves-chutney.jpg,https://datalabs.siva3.io/image/Eunimart_groceries_40191739-3_1-geetarth-curry-leaves-chutney.jpg,https://datalabs.siva3.io/image/Eunimart_groceries_40191739-4_1-geetarth-curry-leaves-chutney.jpg,https://datalabs.siva3.io/image/Eunimart_groceries_40191739-5_1-geetarth-curry-leaves-chutney.jpg,-,-,-,-,-,-,-,-,-,-,-,-,-,-,-,-,-,-,-,-,-,-,-,-,-,-,Ready to eat. Ready to mix in while cooking many dishes.,"[{'EAN Code': '40191739'}, {'Country Of Origin': 'India'}, {'FSSAI Number': '11516037000266'}, {'Manufactured & Marketed By': 'Sujata Home Products, B4/303, Whistling Palms, Wakad, Pune, 411057'}]","Sujata Home Products, B4/303, Whistling Palms, Wakad, Pune, 411057",-,-,-,"Curry Leaves, Roasted Bengal Gram, Tamarind, Garlic, Salt, Sugar, Chilli, Refined Oil",-,-
RET,RET-10,RET-10-1C,RET-10-1C-10,RET-10-1C-10-14,GEETARTH,"GEETARTH Gun Powder Chutney, 100 g","Gun Powder Chutney is a healthy ready to eat Chutney, which can be used as a side dish along with many morning snacks/breakfast/meals. It is tasty and healthy if mixed with curd, Ghee, Butter etc.
Chutney is a traditional accompaniment and integral part of Indian cuisine, it is made from various kinds of spices, fruits, and seeds varies with the kind of chutney. Chutney will be sweet, tangy and spicy as per variety.",100 g,g,100 g,1,1,80,80,"Sujata Home Products, B4/303, Whistling Palms, Wakad, Pune, 411057",India,['40191746'],['11516037000266'],https://datalabs.siva3.io/image/Eunimart_groceries_40191746_2-geetarth-gun-powder-chutney.jpg,https://datalabs.siva3.io/image/Eunimart_groceries_40191746-2_2-geetarth-gun-powder-chutney.jpg,https://datalabs.siva3.io/image/Eunimart_groceries_40191746-3_2-geetarth-gun-powder-chutney.jpg,https://datalabs.siva3.io/image/Eunimart_groceries_40191746-4_2-geetarth-gun-powder-chutney.jpg,https://datalabs.siva3.io/image/Eunimart_groceries_40191746-5_2-geetarth-gun-powder-chutney.jpg,https://datalabs.siva3.io/image/Eunimart_groceries_40191746-6_1-geetarth-gun-powder-chutney.jpg,-,-,-,-,-,-,-,-,-,-,-,-,-,-,-,-,-,-,-,-,-,-,-,-,-,Need to mix with appropriate curd or ghee or butter as per the taste required. Immediately can be served along with any dish.,"[{'EAN Code': '40191746'}, {'Country Of Origin': 'India'}, {'FSSAI Number': '11516037000266'}, {'Manufactured & Marketed By': 'Sujata Home Products, B4/303, Whistling Palms, Wakad, Pune, 411057'}]","Sujata Home Products, B4/303, Whistling Palms, Wakad, Pune, 411057",-,-,-,"Roasted Bengal Gram, Chana Dal, Udad Dal, Sesame Seeds, Chilli Powder, Tamarind, Mixed Spices, Salt, Asafoetida, Soyabean Oil",-,-
RET,RET-10,RET-10-1C,RET-10-1C-10,RET-10-1C-10-14,GEETARTH,"GEETARTH Instant Idly Chutney, 100 g","Instant Idly chutney is ready to use along with Dosa, Uttappa, Appam, Paratha, side dish with any meal etc. Chutney is a traditional accompaniment and integral part of the Indian cuisine, it made from various kind of spices, fruits, and seeds varies with kind of chutneys. Chutney will be a sweet, tangy and spicy as per variety.",100 g,g,100 g,1,1,55,55,"Sujata Home Products, B4/303, Whistling Palms, Wakad, Pune, 411057",India,['8908010046273'],['11516037000266'],https://datalabs.siva3.io/image/Eunimart_groceries_40191745_2-geetarth-instant-idly-chutney.jpg,https://datalabs.siva3.io/image/Eunimart_groceries_40191745-2_2-geetarth-instant-idly-chutney.jpg,https://datalabs.siva3.io/image/Eunimart_groceries_40191745-3_2-geetarth-instant-idly-chutney.jpg,https://datalabs.siva3.io/image/Eunimart_groceries_40191745-4_2-geetarth-instant-idly-chutney.jpg,https://datalabs.siva3.io/image/Eunimart_groceries_40191745-5_2-geetarth-instant-idly-chutney.jpg,https://datalabs.siva3.io/image/Eunimart_groceries_40191745-6_1-geetarth-instant-idly-chutney.jpg,-,-,-,-,-,-,-,-,-,-,-,-,-,-,-,-,-,-,-,-,-,-,-,-,-,Need to mix along with appropriate water or curd as the taste required. Then serve along with any dish.,"['EAN Code: 8908010046273', 'Country Of Origin: India', 'FSSAI Number: 11516037000266', 'Manufactured & Marketed By: Sujata Home Products, B4/303, Whistling Palms, Wakad, Pune, 411057', 'Best before 17-05-2023', '","Sujata Home Products, B4/303, Whistling Palms, Wakad, Pune, 411057",-,-,-,"Coconut, Roasted Bengal Gram, Urad Dal, Green Chillies, Mango Powder, Salt, Mustard Seeds, Curry Leaves, Cumin Seeds, Sugar, Turmeric And Soyabean Oil.",-,-
RET,RET-10,RET-10-1C,RET-10-1C-10,RET-10-1C-10-14,GEETARTH,"GEETARTH Jain Shengdana/Peanut Chutney - No Garlic, 100 g","Shengdana (Pea Nut) is healthy ready to eat Chutney, which can be used as a side dish along with many morning snacks/breakfast /meal. Also, it can be used while cooking vegetable. It is tasty and healthy if mixed with curd, raita etc.
Chutney is a traditional accompaniment and integral part of the Indian cuisine. It made from various kind of spices, fruits, and seeds varies with kind of chutneys. Chutney will be a sweet, tangy and spicy as per variety.",100 g,g,100 g,1,1,55,55,"Sujata Home Products, B4/303, Whistling Palms, Wakad, Pune, 411057",India,['40191750'],['11516037000266'],https://datalabs.siva3.io/image/Eunimart_groceries_40191750_1-geetarth-jain-shengdanapeanut-chutney-no-garlic.jpg,https://datalabs.siva3.io/image/Eunimart_groceries_40191750-2_1-geetarth-jain-shengdanapeanut-chutney-no-garlic.jpg,https://datalabs.siva3.io/image/Eunimart_groceries_40191750-3_1-geetarth-jain-shengdanapeanut-chutney-no-garlic.jpg,https://datalabs.siva3.io/image/Eunimart_groceries_40191750-4_1-geetarth-jain-shengdanapeanut-chutney-no-garlic.jpg,https://datalabs.siva3.io/image/Eunimart_groceries_40191750-5_1-geetarth-jain-shengdanapeanut-chutney-no-garlic.jpg,-,-,-,-,-,-,-,-,-,-,-,-,-,-,-,-,-,-,-,-,-,-,-,-,-,-,Ready to eat. Ready to mix in while cooking many dishes.,"[{'EAN Code': '40191750'}, {'Country Of Origin': 'India'}, {'FSSAI Number': '11516037000266'}, {'Manufactured & Marketed By': 'Sujata Home Products, B4/303, Whistling Palms, Wakad, Pune, 411057'}]","Sujata Home Products, B4/303, Whistling Palms, Wakad, Pune, 411057",-,-,-,"Groundnuts, Red Chilli, Iodised Salt, Cumin Seed, Sugar, Refind Oil.",-,-
