RET,RET-10,RET-10-1A,RET-10-1A-10,RET-10-1A-10-11,Forgreen,"Forgreen Natural Jaggery - Round, No Additives & Preservatives, 500 g","Forgreen Natural Jaggery is a healthy substitute for refined sugar. Jaggery has antioxidants that help to detoxify the body. It's the best detox that helps to remove toxins. Improves the production of digestive juices and enzymes. It induces bowel movements and thus prevents constipation. This jaggery strengthens the bones. For joint pain take jaggery in milk or with ginger juice. It also boosts immunity and maintains the energy level. Made from sugar cane naturally. No added chemicals this jaggery contains many essential nutrients like calcium, iron, magnesium, phosphorus, potassium, and selenium that help in maintaining good health. It also strengthens your body and boosts stamina. It is proven to be a better sweetener agent than white sugar.",500 g,g,500 g,1,1,59,59,"Mayil Organic Farms, 214, MPR street, Madathupalayam, Avinashi 641654, Tamil Nadu",India,['8908002451887'],['11220333000994'],https://datalabs.siva3.io/image/Eunimart_groceries_40284107_1-forgreen-natural-jaggery-round-no-additives-preservatives.jpg,https://datalabs.siva3.io/image/Eunimart_groceries_40284107-2_1-forgreen-natural-jaggery-round-no-additives-preservatives.jpg,https://datalabs.siva3.io/image/Eunimart_groceries_40284107-3_1-forgreen-natural-jaggery-round-no-additives-preservatives.jpg,https://datalabs.siva3.io/image/Eunimart_groceries_40284107-4_1-forgreen-natural-jaggery-round-no-additives-preservatives.jpg,https://datalabs.siva3.io/image/Eunimart_groceries_40284107-5_1-forgreen-natural-jaggery-round-no-additives-preservatives.jpg,https://datalabs.siva3.io/image/Eunimart_groceries_40284107-6_1-forgreen-natural-jaggery-round-no-additives-preservatives.jpg,https://datalabs.siva3.io/image/Eunimart_groceries_40284107-7_1-forgreen-natural-jaggery-round-no-additives-preservatives.jpg,-,-,-,-,-,-,-,-,-,-,-,-,-,-,-,-,-,-,-,-,-,-,-,-,"Replace white sugar with natural jaggery, which can be used in tea, coffee, oats, sweet pongal, etc.","['EAN Code: 8908002451887', 'Manufactured Name & Marketed ByMayil Organic Farms, 214, MPR street, Madathupalayam, Avinashi 641654, Tamil Nadu', 'FSSAI:11220333000994', 'Country of Origin: India', 'Best before 28-11-2023', '",-,-,-,-,Natural Sugarcane Jaggery,-,-,-
RET,RET-10,RET-10-1A,RET-10-1A-10,RET-10-1A-10-11,Forgreen,"Forgreen Natural Jaggery/Bella Powder, 1 kg","ForGreen Natural Jaggery Powder: Healthy and tasty alternative for refind sugar, Rich source of iron, magnesium, phosphorus, zinc, Tastes great in sweet Pongal, Kheer, Laddoos, Milk tea & Green tea",1 kg,kg,1 kg,1,1,119,119,"Mayil Organic Farms, 214, MPR street, Madathupalayam, Avinashi 641654, Tamil Nadu",India,[75040515018],-,https://datalabs.siva3.io/image/Eunimart_groceries_40017929_2-forgreen-natural-jaggery-powder.jpg,https://datalabs.siva3.io/image/Eunimart_groceries_40017929-2_1-forgreen-natural-jaggery-powder.jpg,https://datalabs.siva3.io/image/Eunimart_groceries_40017929-3_1-forgreen-natural-jaggery-powder.jpg,-,-,-,-,-,-,-,-,-,-,-,-,-,-,-,-,-,-,-,-,-,-,-,-,-,-,-,-,-,-,-,-,-,-,-,-,-,"ForGreen Natural Jaggery Powder: Healthy and tasty alternative for refind sugar, Rich source of iron, magnesium, phosphorus, zinc, Tastes great in sweet Pongal, Kheer, Laddoos, Milk tea & Green tea"
RET,RET-10,RET-10-1A,RET-10-1A-10,RET-10-1A-10-11,Forgreen,"Forgreen Natural Jaggery/Bella Powder, 500 g Pouch",-,500 g Pouch,g,500 g Pouch,1,1,59,59,"Mayil Organic Farms, 214, MPR street, Madathupalayam, Avinashi 641654, Tamil Nadu",India,[-],-,https://datalabs.siva3.io/image/Eunimart_groceries_40008427_4-forgreen-natural-jaggery-powder.jpg,https://datalabs.siva3.io/image/Eunimart_groceries_40008427-2_3-forgreen-natural-jaggery-powder.jpg,https://datalabs.siva3.io/image/Eunimart_groceries_40008427-3_2-forgreen-natural-jaggery-powder.jpg,https://datalabs.siva3.io/image/Eunimart_groceries_40008427-4_2-forgreen-natural-jaggery-powder.jpg,-,-,-,-,-,-,-,-,-,-,-,-,-,-,-,-,-,-,-,-,-,-,-,-,-,-,-,-,-,-,-,-,-,Natural Jaggery Powder,-,-,"ForGreen Natural Jaggery Powder: Healthy and tasty alternative for refind sugar, Rich source of iron, magnesium, phosphorus, zinc, Tastes great in sweet Pongal, Kheer, Laddoos, Milk tea & Green tea"
RET,RET-10,RET-10-1A,RET-10-1A-10,RET-10-1A-10-11,Fortune,"Fortune Fine Grain Sugar - Sulphurless Process, Pure & Hygienic, 1 kg","Fortune Fine Grain Sugar is untouched by hand and is made using a sulphur less process. The sugar is of premium quality and the crystals are sparkling white and easy to dissolve. This is processed keeping all the international standards of hygiene and purity in place. It is made with 100% cane sugar. Sugar is made by refining and processing sugarcane juice. It is extracted, purified, filtered, and then finally crystallized to form sugar. From morning tea to your favourite dessert after a meal, add the goodness of Fortunes premium quality sugar. Make your sweet moments safer and purer!",1 kg,kg,1 kg,1,1,65,52,"SHREE RENUKA SUGARS LIMITED, RS.367/H, Village- Munoli, Tq-Saundatti,Belgaum(Karnataka), Karnataka, 591117, SHREE RENUKA SUGARS LIMITED, Sy.No. 377-385 Village-Burlatti (Kokatnur), Tq-Athani,Belgaum(Karnataka), Karnataka, 591230, SHREE RENUKA SUGARS LIMITED, City Center, Debhog, Haldia Purba Midinipur, Medinipur (West Bengal), West Bengal,721657",India,['40252443'],['10013021000661'],https://datalabs.siva3.io/image/Eunimart_groceries_40252443_2-fortune-fine-grain-sugar-sulphurless-process-pure-hygienic.jpg,https://datalabs.siva3.io/image/Eunimart_groceries_40252443-2_2-fortune-fine-grain-sugar-sulphurless-process-pure-hygienic.jpg,https://datalabs.siva3.io/image/Eunimart_groceries_40252443-3_2-fortune-fine-grain-sugar-sulphurless-process-pure-hygienic.jpg,https://datalabs.siva3.io/image/Eunimart_groceries_40252443-4_2-fortune-fine-grain-sugar-sulphurless-process-pure-hygienic.jpg,https://datalabs.siva3.io/image/Eunimart_groceries_40252443-5_2-fortune-fine-grain-sugar-sulphurless-process-pure-hygienic.jpg,https://datalabs.siva3.io/image/Eunimart_groceries_40252443-6_2-fortune-fine-grain-sugar-sulphurless-process-pure-hygienic.jpg,-,-,-,-,-,-,-,-,-,-,-,-,-,-,-,-,-,-,-,-,-,-,-,-,-,-,"['EAN Code: 40252443', 'FSSAI No: 10013021000661', 'Manufactured & Marketed by:SHREE RENUKA SUGARS LIMITED, RS.367/H, Village- Munoli, Tq-Saundatti,Belgaum(Karnataka), Karnataka, 591117, SHREE RENUKA SUGARS LIMITED, Sy.No. 377-385 Village-Burlatti (Kokatnur), Tq-Athani,Belgaum(Karnataka), Karnataka, 591230, SHREE RENUKA SUGARS LIMITED, City Center, Debhog, Haldia Purba Midinipur, Medinipur (West Bengal), West Bengal,721657', 'Country of origin: India < br> Best before 02-03-2024', '","SHREE RENUKA SUGARS LIMITED, RS.367/H, Village- Munoli, Tq-Saundatti,Belgaum(Karnataka), Karnataka, 591117, SHREE RENUKA SUGARS LIMITED, Sy.No. 377-385 Village-Burlatti (Kokatnur), Tq-Athani,Belgaum(Karnataka), Karnataka, 591230, SHREE RENUKA SUGARS LIMITED, City Center, Debhog, Haldia Purba Midinipur, Medinipur (West Bengal), West Bengal,721657",-,-,-,Refined Sugar Made from Sugarcane,-,-,-
RET,RET-10,RET-10-1A,RET-10-1A-10,RET-10-1A-10-11,Future Organics,"Future Organics Salt/Uppu - Himalayan Pink, 500 g","Future Organics Salt Himalayan Pink is not only the purest form of salt available but also provides multiple health benefits. Mined from the ancient sea salt deposits of the Himalayan Mountains, it contains up to 84 naturally occuring elements in the human body. Interesting and vibrant with its features, this pink salt is thought to be much more natural than table salt. Himalayan salt's rich mineral content can help your body detoxify. All of these minerals aid our body's natural detoxification process and promote the removal of bacteria. Use it in your sauces and marinades or replace your regular salt to see the difference. Explore the variety of products offered by Future Organics from Curry Leaf Powder, Gongura Pickle to Himalayan Honey and more, only on Big Basket!",500 g,g,500 g,1,1,150,150,"DEGA FARMS : CHOKANATHAPURAM VILLAGE, KAGGANUR- NALLUR ROAD, HOSUR TALUK, TAMIL NADU, INDIA",India,[75040515018],-,https://datalabs.siva3.io/image/Eunimart_groceries_77817_6-future-organics-salt-himalayan-pink.jpg,https://datalabs.siva3.io/image/Eunimart_groceries_77817-2_3-future-organics-salt-himalayan-pink.jpg,https://datalabs.siva3.io/image/Eunimart_groceries_77817-3_3-future-organics-salt-himalayan-pink.jpg,https://datalabs.siva3.io/image/Eunimart_groceries_77817-4_2-future-organics-salt-himalayan-pink.jpg,-,-,-,-,-,-,-,-,-,-,-,-,-,-,-,-,-,-,-,-,-,-,-,-,-,-,"1. Unrefined salt
2. Additive-free",-,"['EAN Code: 75040515018 Manufacturer Name & : DEGA FARMS : CHOKANATHAPURAM VILLAGE, KAGGANUR- NALLUR ROAD, HOSUR TALUK, TAMIL NADU, INDIA Country of origin: India Best before 03-10-2022 ",-,-,-,-,"1. Unrefined salt
2. Additive-free",-,-,-
RET,RET-10,RET-10-1A,RET-10-1A-10,RET-10-1A-10-11,GoodDiet,"GoodDiet Himalayan Pink Rock Salt/Uppu - Crystal, 1 kg","Good Diet Himalayan Pink Rock Salt Crystal is sourced directly from the salt mines of Himalayas, completely natural, free from chemicals or additives. With its pink hue and focus towards health, this salt is a great subsitute for common salt. It is naturally rich in minerals and adds great flavouring to dishes. Use it just as you would use regular salt in your curries, sauces and marinades. It is a better alternative over normal salt for people with hypertension. You can drink Himalayan saltwater as a beverage regularly but only in small amounts so that the beneficial properties do not backfire. Use it as part of cooking, to season meals, and to preserve food. Or use it just as you would use regular salt in your curries, sauces and marinades. Explore the range of staples like Salt and Oil to snacks like Butter Makhana and Tangy Ragi Sticks offered by Good Diet, only on Big Basket!",1 kg,kg,1 kg,1,1,110,99,"Terra Firma Projects Private Limited, The Fields, Survey No. 84, Kondakal Road, Bulkapur Village, Shankarpally Mandal, Ranga Reddy Dist. Telangana 500016 ",India,[-],[13615010000183],https://datalabs.siva3.io/image/Eunimart_groceries_40142906_5-gooddiet-himalayan-pink-rock-salt-crystal.jpg,https://datalabs.siva3.io/image/Eunimart_groceries_40142906-2_7-gooddiet-himalayan-pink-rock-salt-crystal.jpg,https://datalabs.siva3.io/image/Eunimart_groceries_40142906-3_7-gooddiet-himalayan-pink-rock-salt-crystal.jpg,https://datalabs.siva3.io/image/Eunimart_groceries_40142906-4_6-gooddiet-himalayan-pink-rock-salt-crystal.jpg,-,-,-,-,-,-,-,-,-,-,-,-,-,-,-,-,-,-,-,-,-,-,-,-,-,-,"1. Unrefined salt
2. Additive-free",-,"['EAN Code: 8904256709828 Country Of Origin: India FSSAI Number: 13615010000183 Manufacturer name & address: Terra Firma Projects Private Limited, The Fields, Survey No. 84, Kondakal Road, Bulkapur Village, Shankarpally Mandal, Ranga Reddy Dist. Telangana 500016 Marketed by: Supermarket Grocery Supplies Private Limited, Fairway Business Park, EGL, Challaghatta, Domlur, Bengaluru, 560071 FSSAI Number: 10019043002767 Best before 30-03-2023 ","8904256709828 Country Of Origin: India FSSAI Number: 13615010000183 Manufacturer name & address: Terra Firma Projects Private Limited, The Fields, Survey No. 84, Kondakal Road, Bulkapur Village, Shankarpally Mandal, Ranga Reddy Dist. Telangana 500016 Marketed by: Supermarket Grocery Supplies Private Limited, Fairway Business Park, EGL, Challaghatta, Domlur, Bengaluru, 560071 FSSAI Number: 10019043002767 Best before 30-03-2023 For Queries/Feedback/Complaints, Contact our Customer Care Executive at: Phone: 1860 123 1000 | Address: Innovative Retail Concepts Private Limited, Ranka Junction 4th Floor, Tin Factory bus stop. KR Puram, Bangalore - 560016. Email:customerservice@bigbasket.com",-,-,-,"1. Unrefined salt
2. Additive-free",-,-,-
RET,RET-10,RET-10-1A,RET-10-1A-10,RET-10-1A-10-11,GoodDiet,"GoodDiet Himalayan Pink Rock Salt/Uppu Powder, 1 kg",-,1 kg,kg,1 kg,1,1,110,95,"Terra Firma Projects Private Limited, The Fields, Survey No. 84, Kondakal Road, Bulkapur Village, Shankarpally Mandal, Ranga Reddy Dist. Telangana 500016 ",India,[-],[13615010000183],https://datalabs.siva3.io/image/Eunimart_groceries_40142905_6-gooddiet-himalayan-pink-rock-salt-powder.jpg,https://datalabs.siva3.io/image/Eunimart_groceries_40142905-2_8-gooddiet-himalayan-pink-rock-salt-powder.jpg,https://datalabs.siva3.io/image/Eunimart_groceries_40142905-3_8-gooddiet-himalayan-pink-rock-salt-powder.jpg,https://datalabs.siva3.io/image/Eunimart_groceries_40142905-4_7-gooddiet-himalayan-pink-rock-salt-powder.jpg,-,-,-,-,-,-,-,-,-,-,-,-,-,-,-,-,-,-,-,-,-,-,-,-,-,-,"1. Unrefined salt
2. Additive-free",-,"[{'EAN Code': '8904256709811 Country Of Origin: India FSSAI Number: 13615010000183 Manufacturer name & address: Terra Firma Projects Private Limited, The Fields, Survey No. 84, Kondakal Road, Bulkapur Village, Shankarpally Mandal, Ranga Reddy Dist. Telangana 500016 Marketed by: Supermarket Grocery Supplies Private Limited, Fairway Business Park, EGL, Challaghatta, Domlur, Bengaluru, 560071 FSSAI Number: 10019043002767 Best before 30-03-2023 ","8904256709811 Country Of Origin: India FSSAI Number: 13615010000183 Manufacturer name & address: Terra Firma Projects Private Limited, The Fields, Survey No. 84, Kondakal Road, Bulkapur Village, Shankarpally Mandal, Ranga Reddy Dist. Telangana 500016 Marketed by: Supermarket Grocery Supplies Private Limited, Fairway Business Park, EGL, Challaghatta, Domlur, Bengaluru, 560071 FSSAI Number: 10019043002767 Best before 30-03-2023 For Queries/Feedback/Complaints, Contact our Customer Care Executive at: Phone: 1860 123 1000 | Address: Innovative Retail Concepts Private Limited, Ranka Junction 4th Floor, Tin Factory bus stop. KR Puram, Bangalore - 560016. Email:customerservice@bigbasket.com",-,-,-,"1. Unrefined salt
2. Additive-free",-,"About the Product
Good Diet Himalayan Pink Rock Salt Powder is sourced directly from the salt mines of Himalayas, completely natural, free from chemicals or additives. With its pink hue and focus towards health, this salt is a great subsitute for common salt. It is naturally rich in minerals and adds great flavouring to dishes. Use it just as you would use regular salt in your curries, sauces and marinades. It is a better alternative over normal salt for people with hypertension. You can drink Himalayan saltwater as a beverage regularly but only in small amounts so that the beneficial properties do not backfire. Use it as part of cooking, to season meals, and to preserve food. Explore the range of staples like Salt and Oil to snacks like Butter Makhana and Tangy Ragi Sticks offered by Good Diet, only on Big Basket!",-
RET,RET-10,RET-10-1A,RET-10-1A-10,RET-10-1A-10-11,GoodDiet,"GoodDiet Organic Coconut Sugar - Healthy Alternate, Low Glycemic Index, 250 g","Rich in Natural Nutrients like, Calcium, Magnesium, Potassium, Iron, Phosphorous. Good for home use, Tea & Coffee /All seweets etc.",250 g,g,250 g,1,1,249,179,"Amaara Food & Wellness Pvt. Ltd., Plot No.527, Sector-8, IMT Manesar, Haryana 122050",India,['40227945'],"['10818005000415,10020043003172']",https://datalabs.siva3.io/image/Eunimart_groceries_40227945_1-gooddiet-organic-coconut-sugar.jpg,https://datalabs.siva3.io/image/Eunimart_groceries_40227945-2_1-gooddiet-organic-coconut-sugar.jpg,https://datalabs.siva3.io/image/Eunimart_groceries_40227945-3_1-gooddiet-organic-coconut-sugar.jpg,https://datalabs.siva3.io/image/Eunimart_groceries_40227945-4_1-gooddiet-organic-coconut-sugar.jpg,https://datalabs.siva3.io/image/Eunimart_groceries_40227945-5_1-gooddiet-organic-coconut-sugar.jpg,https://datalabs.siva3.io/image/Eunimart_groceries_40227945-6_1-gooddiet-organic-coconut-sugar.jpg,https://datalabs.siva3.io/image/Eunimart_groceries_40227945-7_1-gooddiet-organic-coconut-sugar.jpg,-,-,-,-,-,-,-,-,-,-,-,-,-,-,-,-,-,-,-,-,-,-,-,-,"Can be used in tea, coffee, cooking, baking etc.","['EAN Code:40227945', 'FSSAI Number: 10818005000415, 10020043003172', 'Manufacturer Name & : Amaara Food & Wellness Pvt. Ltd., Plot No.527, Sector-8, IMT Manesar, Haryana 122050', 'Marketed by: Innovative Retail Concepts Pvt. Ltd., Ranka Junction, No. 224, 4th Floor, Vijinapura, Old Madras Road, K. R. Puram, Bengaluru - 560016', 'Country of Origin: India', 'Best before__PSL__days from delivery date', '","Innovative Retail Concepts Pvt. Ltd., Ranka Junction, No. 224, 4th Floor, Vijinapura, Old Madras Road, K. R. Puram, Bengaluru - 560016",-,-,-,Organic Coconut Sugar,-,-,-
RET,RET-10,RET-10-1A,RET-10-1A-10,RET-10-1A-10-11,Graminway,"Graminway Himalayan Pink Salt, 350 g Bottle","Graminway Himalayan Pink Salt is purest form salt, rich in traces of 84 minerals, it has lots of health benefits such as detoxifies the body by balancing pH, helps in balancing blood sugar, helps blood pressure because it provides unrefined, mineral-rich salt and it also supports weight loss by balancing hormone balance. At Graminway, they believe that everyone deserves to live a full and healthy life. The intake of their food supplements will provide a good foundation for a healthy lifestyle. They are committed to providing the highest quality products at affordable price. They are a company with a purpose beyond profit and want to make a lasting difference in the world. Graminway aims to provide clean, natural, and healthy products without compromising on the flavours and taste. They produce them in small batches, which helps maintain freshness and preserve the ingredient texture. By not stockpiling, each product is as fresh as possible when it reaches your doorstep. Weight : 350 gm",350 g Bottle,g,350 g Bottle,1,1,59,59,Graminway,India,['8747356051781'],['21218193000378'],https://datalabs.siva3.io/image/Eunimart_groceries_40147748_2-graminway-himalayan-pink-salt.jpg,https://datalabs.siva3.io/image/Eunimart_groceries_40147748-2_2-graminway-himalayan-pink-salt.jpg,https://datalabs.siva3.io/image/Eunimart_groceries_40147748-3_2-graminway-himalayan-pink-salt.jpg,https://datalabs.siva3.io/image/Eunimart_groceries_40147748-4_1-graminway-himalayan-pink-salt.jpg,-,-,-,-,-,-,-,-,-,-,-,-,-,-,-,-,-,-,-,-,-,-,-,-,-,-,-,-,"['EAN Code: 8747356051781', 'Country of origin: India', 'FSSAI Number: 21218193000378', 'Marketed by: VENDIMIA FOOD PRIVATE LIMITED. Registered Office: #1882, 2nd Floor, 10th Main, 31st Cross, Banashankari, 2nd Stage, Bangalore - 560070, Karnataka', 'Best before 02-03-2024', 'For queries call 1860 123 1000']","VENDIMIA FOOD PRIVATE LIMITED. Registered Office: #1882, 2nd Floor, 10th Main, 31st Cross, Banashankari, 2nd Stage, Bangalore - 560070, Karnataka",-,-,-,Pink Salt,-,-,-
RET,RET-10,RET-10-1A,RET-10-1A-10,RET-10-1A-10-11,Graminway,"Graminway Sea Salt, 350 g Bottle","Sea salt, as is quite clear from the name, is salt that is produced by evaporating ocean water or saltwater from lakes. Thus, it contains traces of some essential minerals, depending on which area it has been produced from, which give it a distinct taste and colour. At Graminway, they believe that everyone deserves to live a full and healthy life. The intake of their food supplements will provide a good foundation for a healthy lifestyle. They are committed to providing the highest quality products at affordable price. They are a company with a purpose beyond profit and want to make a lasting difference in the world. Graminway aims to provide clean, natural, and healthy products without compromising on the flavours and taste. They produce them in small batches, which helps maintain freshness and preserve the ingredient texture. By not stockpiling, each product is as fresh as possible when it reaches your doorstep. Weight : 350 gm",350 g Bottle,g,350 g Bottle,1,1,59,59,Graminway,India,['747356051804'],['21218193000378'],https://datalabs.siva3.io/image/Eunimart_groceries_40147737_3-graminway-sea-salt.jpg,https://datalabs.siva3.io/image/Eunimart_groceries_40147737-2_3-graminway-sea-salt.jpg,https://datalabs.siva3.io/image/Eunimart_groceries_40147737-3_3-graminway-sea-salt.jpg,https://datalabs.siva3.io/image/Eunimart_groceries_40147737-4_2-graminway-sea-salt.jpg,https://datalabs.siva3.io/image/Eunimart_groceries_40147737-5_1-graminway-sea-salt.jpg,-,-,-,-,-,-,-,-,-,-,-,-,-,-,-,-,-,-,-,-,-,-,-,-,-,-,-,"['EAN Code: 747356051804', 'Country of origin: India', 'FSSAI Number: 21218193000378', 'Marketed by: VENDIMIA FOOD PRIVATE LIMITED. Registered Office: #1882, 2nd Floor, 10th Main, 31st Cross, Banashankari, 2nd Stage, Bangalore - 560070, Karnataka', 'Best before 02-03-2024', 'For queries call 1860 123 1000']","VENDIMIA FOOD PRIVATE LIMITED. Registered Office: #1882, 2nd Floor, 10th Main, 31st Cross, Banashankari, 2nd Stage, Bangalore - 560070, Karnataka",-,-,-,Sea Salt,-,-,-
RET,RET-10,RET-10-1A,RET-10-1A-10,RET-10-1A-10-11,Harin,"Harin Coconut Sugar - 100% Pure, Raw, Unrefined, 250 g","A perfect, ideal natural plant-based sugar that can be used as an alternative to refined sugars and artificial sweeteners. Enjoy our Harin Coconut Sugar as a one-to-one replacement for white sugar in tea, coffee, juices, spreads, cookies, cakes, etc. Harin Coconut Sugar is 100% natural and made from the sap of the coconut tree product. It is a low glycemic index sugar, thus a healthier alternative to refined cane sugar and an ideal sugar replacement for people having diabetes. 
It is suitable for consumers of all ages.
It is plant-based and 100% natural sugar.
It is a low glycemic sugar with small traces of vitamins, minerals and other micronutrients.
It has a shelf life of 365 days.
Storage Instructions: Best to be stored in a cool and dry place, away from sunlight and moisture.",250 g,g,250 g,1,1,250,250,"Harin Bio-Tech International (P) Limited, 215/1, Panchapalli Main Road, Samnur, Marandhalli, Dharmapuri District, Tamil Nadu - 636806.",India,['8904304387107'],['12415005000098'],https://datalabs.siva3.io/image/Eunimart_groceries_40256737_1-harin-coconut-sugar-100-pure-raw-unrefined.jpg,https://datalabs.siva3.io/image/Eunimart_groceries_40256737-2_1-harin-coconut-sugar-100-pure-raw-unrefined.jpg,https://datalabs.siva3.io/image/Eunimart_groceries_40256737-3_1-harin-coconut-sugar-100-pure-raw-unrefined.jpg,https://datalabs.siva3.io/image/Eunimart_groceries_40256737-4_1-harin-coconut-sugar-100-pure-raw-unrefined.jpg,https://datalabs.siva3.io/image/Eunimart_groceries_40256737-5_1-harin-coconut-sugar-100-pure-raw-unrefined.jpg,https://datalabs.siva3.io/image/Eunimart_groceries_40256737-6_1-harin-coconut-sugar-100-pure-raw-unrefined.jpg,-,-,-,-,-,-,-,-,-,-,-,-,-,-,-,-,-,-,-,-,-,-,-,-,-,"A great and better replacement for white sugar in making different recipes and dishes including desserts.
Use it to make some good cups of tea, juices and coffee and you are good to go.","['EAN Code: 8904304387107', 'Country Of Origin: India', 'Manufacturer Name and : Harin Bio-Tech International (P) Limited, 215/1, Panchapalli Main Road, Samnur, Marandhalli, Dharmapuri District, Tamil Nadu - 636806.', 'FSSAI Number:12415005000098', 'Best before 02-09-2023', '",-,-,-,-,Pure Natural Raw Coconut Sugar,-,-,-
RET,RET-10,RET-10-1A,RET-10-1A-10,RET-10-1A-10-11,Himalayan Natives,"Himalayan Natives 100% Natural Jaggery Powder - Healthy Sugar Substitute, 500 g",Himalayan Native 100% Natural Jaggery Powder is made with high-quality standards to ensure the purity of the product. The jaggery powder is a perfect alternative to refined white sugar. It is a rich source of antioxidants and minerals that helps the body detox and also supports digestion. This jaggery powder by Himalayan Natives comes in good pouch packing.,500 g,g,500 g,1,1,120,68.4,"Khanal Foods Private Limited.,#40, Goshala Road, Garudachar Palya,Mahadevapura Post, Bangalore-560048, Karnataka, India",India,['40228890'],['11219333000096'],https://datalabs.siva3.io/image/Eunimart_groceries_40228890_3-himalayan-natives-100-natural-jaggery-powder-healthy-sugar-substitute.jpg,https://datalabs.siva3.io/image/Eunimart_groceries_40228890-2_3-himalayan-natives-100-natural-jaggery-powder-healthy-sugar-substitute.jpg,https://datalabs.siva3.io/image/Eunimart_groceries_40228890-3_3-himalayan-natives-100-natural-jaggery-powder-healthy-sugar-substitute.jpg,https://datalabs.siva3.io/image/Eunimart_groceries_40228890-4_3-himalayan-natives-100-natural-jaggery-powder-healthy-sugar-substitute.jpg,https://datalabs.siva3.io/image/Eunimart_groceries_40228890-5_3-himalayan-natives-100-natural-jaggery-powder-healthy-sugar-substitute.jpg,https://datalabs.siva3.io/image/Eunimart_groceries_40228890-6_2-himalayan-natives-100-natural-jaggery-powder-healthy-sugar-substitute.jpg,https://datalabs.siva3.io/image/Eunimart_groceries_40228890-7_2-himalayan-natives-100-natural-jaggery-powder-healthy-sugar-substitute.jpg,-,-,-,-,-,-,-,-,-,-,-,-,-,-,-,-,-,-,-,-,-,-,-,-,"It can be used in sweet dishes.
Can be used in drinks.","['EAN Code: 40228890', 'FSSAI Number: 11219333000096', 'Manufactured & Marketed By: Khanal Foods Private Limited.,#40, Goshala Road, Garudachar Palya,Mahadevapura Post, Bangalore-560048, Karnataka, India', 'Country of Origin: India', 'Best before 30-08-2023', '","Khanal Foods Private Limited.,#40, Goshala Road, Garudachar Palya,Mahadevapura Post, Bangalore-560048, Karnataka, India",-,-,-,Jaggery Powder,-,-,-
